joke_id,source_id,title,body,score,permalink
319,zh-0319,"镜子去邮局","镜子来到邮局，门口问：“来做什么？”回答：“先和今天的自己对个焦，再给未来寄一封提醒信。”",100,
320,zh-0320,"镜子去办公室","镜子来到办公室，门口问：“来做什么？”回答：“先和今天的自己对个焦，再给星期一安装一个补丁。”",100,
321,zh-0321,"袜子去图书馆","袜子来到图书馆，门口问：“来做什么？”回答：“先找回走丢的另一半，再给知识续个借阅期。”",100,
322,zh-0322,"袜子去咖啡店","袜子来到咖啡店，门口问：“来做什么？”回答：“先找回走丢的另一半，再把困意打包带走。”",100,
323,zh-0323,"袜子去健身房","袜子来到健身房，门口问：“来做什么？”回答：“先找回走丢的另一半，再给意志力加点负载。”",100,
324,zh-0324,"袜子去银行","袜子来到银行，门口问：“来做什么？”回答：“先找回走丢的另一半，再给快乐存一点利息。”",100,
325,zh-0325,"袜子去公园","袜子来到公园，门口问：“来做什么？”回答：“先找回走丢的另一半，再让思路好好散个步。”",100,
326,zh-0326,"袜子去超市","袜子来到超市，门口问：“来做什么？”回答：“先找回走丢的另一半，再把好运加入购物车。”",100,
327,zh-0327,"袜子去车站","袜子来到车站，门口问：“来做什么？”回答：“先找回走丢的另一半，再等下一班好心情。”",100,
328,zh-0328,"袜子去电影院","袜子来到电影院，门口问：“来做什么？”回答：“先找回走丢的另一半，再给生活换个喜剧频道。”",100,
329,zh-0329,"袜子去餐厅","袜子来到餐厅，门口问：“来做什么？”回答：“先找回走丢的另一半，再给胃安排一次会议。”",100,
330,zh-0330,"袜子去学校","袜子来到学校，门口问：“来做什么？”回答：“先找回走丢的另一半，再给好奇心补一节课。”",100,
331,zh-0331,"袜子去医院","袜子来到医院，门口问：“来做什么？”回答：“先找回走丢的另一半，再给拖延症认真挂个号。”",100,
332,zh-0332,"袜子去理发店","袜子来到理发店，门口问：“来做什么？”回答：“先找回走丢的另一半，再把烦恼再剪短一点。”",100,
333,zh-0333,"袜子去花店","袜子来到花店，门口问：“来做什么？”回答：“先找回走丢的另一半，再给普通日子配点颜色。”",100,
334,zh-0334,"袜子去面包店","袜子来到面包店，门口问：“来做什么？”回答：“先找回走丢的另一半，再让新计划先发酵一下。”",100,
335,zh-0335,"袜子去博物馆","袜子来到博物馆，门口问：“来做什么？”回答：“先找回走丢的另一半，再看看旧问题有没有新答案。”",100,
336,zh-0336,"袜子去游泳馆","袜子来到游泳馆，门口问：“来做什么？”回答：“先找回走丢的另一半，再让压力学会自己漂浮。”",100,
337,zh-0337,"袜子去邮局","袜子来到邮局，门口问：“来做什么？”回答：“先找回走丢的另一半，再给未来寄一封提醒信。”",100,
338,zh-0338,"袜子去办公室","袜子来到办公室，门口问：“来做什么？”回答：“先找回走丢的另一半，再给星期一安装一个补丁。”",100,
339,zh-0339,"杯子去图书馆","杯子来到图书馆，门口问：“来做什么？”回答：“先把快乐装到八分满，再给知识续个借阅期。”",100,
340,zh-0340,"杯子去咖啡店","杯子来到咖啡店，门口问：“来做什么？”回答：“先把快乐装到八分满，再把困意打包带走。”",100,
341,zh-0341,"杯子去健身房","杯子来到健身房，门口问：“来做什么？”回答：“先把快乐装到八分满，再给意志力加点负载。”",100,
342,zh-0342,"杯子去银行","杯子来到银行，门口问：“来做什么？”回答：“先把快乐装到八分满，再给快乐存一点利息。”",100,
343,zh-0343,"杯子去公园","杯子来到公园，门口问：“来做什么？”回答：“先把快乐装到八分满，再让思路好好散个步。”",100,
344,zh-0344,"杯子去超市","杯子来到超市，门口问：“来做什么？”回答：“先把快乐装到八分满，再把好运加入购物车。”",100,
345,zh-0345,"杯子去车站","杯子来到车站，门口问：“来做什么？”回答：“先把快乐装到八分满，再等下一班好心情。”",100,
346,zh-0346,"杯子去电影院","杯子来到电影院，门口问：“来做什么？”回答：“先把快乐装到八分满，再给生活换个喜剧频道。”",100,
347,zh-0347,"杯子去餐厅","杯子来到餐厅，门口问：“来做什么？”回答：“先把快乐装到八分满，再给胃安排一次会议。”",100,
348,zh-0348,"杯子去学校","杯子来到学校，门口问：“来做什么？”回答：“先把快乐装到八分满，再给好奇心补一节课。”",100,
349,zh-0349,"杯子去医院","杯子来到医院，门口问：“来做什么？”回答：“先把快乐装到八分满，再给拖延症认真挂个号。”",100,
350,zh-0350,"杯子去理发店","杯子来到理发店，门口问：“来做什么？”回答：“先把快乐装到八分满，再把烦恼再剪短一点。”",100,
351,zh-0351,"杯子去花店","杯子来到花店，门口问：“来做什么？”回答：“先把快乐装到八分满，再给普通日子配点颜色。”",100,
352,zh-0352,"杯子去面包店","杯子来到面包店，门口问：“来做什么？”回答：“先把快乐装到八分满，再让新计划先发酵一下。”",100,
353,zh-0353,"杯子去博物馆","杯子来到博物馆，门口问：“来做什么？”回答：“先把快乐装到八分满，再看看旧问题有没有新答案。”",100,
354,zh-0354,"杯子去游泳馆","杯子来到游泳馆，门口问：“来做什么？”回答：“先把快乐装到八分满，再让压力学会自己漂浮。”",100,
355,zh-0355,"杯子去邮局","杯子来到邮局，门口问：“来做什么？”回答：“先把快乐装到八分满，再给未来寄一封提醒信。”",100,
356,zh-0356,"杯子去办公室","杯子来到办公室，门口问：“来做什么？”回答：“先把快乐装到八分满，再给星期一安装一个补丁。”",100,
357,zh-0357,"椅子去图书馆","椅子来到图书馆，门口问：“来做什么？”回答：“先给疲惫安排一个座位，再给知识续个借阅期。”",100,
358,zh-0358,"椅子去咖啡店","椅子来到咖啡店，门口问：“来做什么？”回答：“先给疲惫安排一个座位，再把困意打包带走。”",100,
359,zh-0359,"椅子去健身房","椅子来到健身房，门口问：“来做什么？”回答：“先给疲惫安排一个座位，再给意志力加点负载。”",100,
360,zh-0360,"椅子去银行","椅子来到银行，门口问：“来做什么？”回答：“先给疲惫安排一个座位，再给快乐存一点利息。”",100,
361,zh-0361,"椅子去公园","椅子来到公园，门口问：“来做什么？”回答：“先给疲惫安排一个座位，再让思路好好散个步。”",100,
362,zh-0362,"椅子去超市","椅子来到超市，门口问：“来做什么？”回答：“先给疲惫安排一个座位，再把好运加入购物车。”",100,
363,zh-0363,"椅子去车站","椅子来到车站，门口问：“来做什么？”回答：“先给疲惫安排一个座位，再等下一班好心情。”",100,
364,zh-0364,"椅子去电影院","椅子来到电影院，门口问：“来做什么？”回答：“先给疲惫安排一个座位，再给生活换个喜剧频道。”",100,
365,zh-0365,"椅子去餐厅","椅子来到餐厅，门口问：“来做什么？”回答：“先给疲惫安排一个座位，再给胃安排一次会议。”",100,
366,zh-0366,"椅子去学校","椅子来到学校，门口问：“来做什么？”回答：“先给疲惫安排一个座位，再给好奇心补一节课。”",100,
367,zh-0367,"椅子去医院","椅子来到医院，门口问：“来做什么？”回答：“先给疲惫安排一个座位，再给拖延症认真挂个号。”",100,
368,zh-0368,"椅子去理发店","椅子来到理发店，门口问：“来做什么？”回答：“先给疲惫安排一个座位，再把烦恼再剪短一点。”",100,
369,zh-0369,"椅子去花店","椅子来到花店，门口问：“来做什么？”回答：“先给疲惫安排一个座位，再给普通日子配点颜色。”",100,
370,zh-0370,"椅子去面包店","椅子来到面包店，门口问：“来做什么？”回答：“先给疲惫安排一个座位，再让新计划先发酵一下。”",100,
371,zh-0371,"椅子去博物馆","椅子来到博物馆，门口问：“来做什么？”回答：“先给疲惫安排一个座位，再看看旧问题有没有新答案。”",100,
372,zh-0372,"椅子去游泳馆","椅子来到游泳馆，门口问：“来做什么？”回答：“先给疲惫安排一个座位，再让压力学会自己漂浮。”",100,
373,zh-0373,"椅子去邮局","椅子来到邮局，门口问：“来做什么？”回答：“先给疲惫安排一个座位，再给未来寄一封提醒信。”",100,
374,zh-0374,"椅子去办公室","椅子来到办公室，门口问：“来做什么？”回答：“先给疲惫安排一个座位，再给星期一安装一个补丁。”",100,
375,zh-0375,"电梯去图书馆","电梯来到图书馆，门口问：“来做什么？”回答：“先把情绪送到更高一层，再给知识续个借阅期。”",100,
376,zh-0376,"电梯去咖啡店","电梯来到咖啡店，门口问：“来做什么？”回答：“先把情绪送到更高一层，再把困意打包带走。”",100,
377,zh-0377,"电梯去健身房","电梯来到健身房，门口问：“来做什么？”回答：“先把情绪送到更高一层，再给意志力加点负载。”",100,
378,zh-0378,"电梯去银行","电梯来到银行，门口问：“来做什么？”回答：“先把情绪送到更高一层，再给快乐存一点利息。”",100,
379,zh-0379,"电梯去公园","电梯来到公园，门口问：“来做什么？”回答：“先把情绪送到更高一层，再让思路好好散个步。”",100,
380,zh-0380,"电梯去超市","电梯来到超市，门口问：“来做什么？”回答：“先把情绪送到更高一层，再把好运加入购物车。”",100,
381,zh-0381,"电梯去车站","电梯来到车站，门口问：“来做什么？”回答：“先把情绪送到更高一层，再等下一班好心情。”",100,
382,zh-0382,"电梯去电影院","电梯来到电影院，门口问：“来做什么？”回答：“先把情绪送到更高一层，再给生活换个喜剧频道。”",100,
383,zh-0383,"电梯去餐厅","电梯来到餐厅，门口问：“来做什么？”回答：“先把情绪送到更高一层，再给胃安排一次会议。”",100,
384,zh-0384,"电梯去学校","电梯来到学校，门口问：“来做什么？”回答：“先把情绪送到更高一层，再给好奇心补一节课。”",100,
385,zh-0385,"电梯去医院","电梯来到医院，门口问：“来做什么？”回答：“先把情绪送到更高一层，再给拖延症认真挂个号。”",100,
386,zh-0386,"电梯去理发店","电梯来到理发店，门口问：“来做什么？”回答：“先把情绪送到更高一层，再把烦恼再剪短一点。”",100,
387,zh-0387,"电梯去花店","电梯来到花店，门口问：“来做什么？”回答：“先把情绪送到更高一层，再给普通日子配点颜色。”",100,
388,zh-0388,"电梯去面包店","电梯来到面包店，门口问：“来做什么？”回答：“先把情绪送到更高一层，再让新计划先发酵一下。”",100,
389,zh-0389,"电梯去博物馆","电梯来到博物馆，门口问：“来做什么？”回答：“先把情绪送到更高一层，再看看旧问题有没有新答案。”",100,
390,zh-0390,"电梯去游泳馆","电梯来到游泳馆，门口问：“来做什么？”回答：“先把情绪送到更高一层，再让压力学会自己漂浮。”",100,
391,zh-0391,"电梯去邮局","电梯来到邮局，门口问：“来做什么？”回答：“先把情绪送到更高一层，再给未来寄一封提醒信。”",100,
392,zh-0392,"电梯去办公室","电梯来到办公室，门口问：“来做什么？”回答：“先把情绪送到更高一层，再给星期一安装一个补丁。”",100,
393,zh-0393,"台灯去图书馆","台灯来到图书馆，门口问：“来做什么？”回答：“先给灵感补一点光，再给知识续个借阅期。”",100,
394,zh-0394,"台灯去咖啡店","台灯来到咖啡店，门口问：“来做什么？”回答：“先给灵感补一点光，再把困意打包带走。”",100,
395,zh-0395,"台灯去健身房","台灯来到健身房，门口问：“来做什么？”回答：“先给灵感补一点光，再给意志力加点负载。”",100,
396,zh-0396,"台灯去银行","台灯来到银行，门口问：“来做什么？”回答：“先给灵感补一点光，再给快乐存一点利息。”",100,
397,zh-0397,"台灯去公园","台灯来到公园，门口问：“来做什么？”回答：“先给灵感补一点光，再让思路好好散个步。”",100,
398,zh-0398,"台灯去超市","台灯来到超市，门口问：“来做什么？”回答：“先给灵感补一点光，再把好运加入购物车。”",100,
399,zh-0399,"台灯去车站","台灯来到车站，门口问：“来做什么？”回答：“先给灵感补一点光，再等下一班好心情。”",100,
400,zh-0400,"台灯去电影院","台灯来到电影院，门口问：“来做什么？”回答：“先给灵感补一点光，再给生活换个喜剧频道。”",100,
401,zh-0401,"台灯去餐厅","台灯来到餐厅，门口问：“来做什么？”回答：“先给灵感补一点光，再给胃安排一次会议。”",100,
402,zh-0402,"台灯去学校","台灯来到学校，门口问：“来做什么？”回答：“先给灵感补一点光，再给好奇心补一节课。”",100,
403,zh-0403,"台灯去医院","台灯来到医院，门口问：“来做什么？”回答：“先给灵感补一点光，再给拖延症认真挂个号。”",100,
404,zh-0404,"台灯去理发店","台灯来到理发店，门口问：“来做什么？”回答：“先给灵感补一点光，再把烦恼再剪短一点。”",100,
405,zh-0405,"台灯去花店","台灯来到花店，门口问：“来做什么？”回答：“先给灵感补一点光，再给普通日子配点颜色。”",100,
406,zh-0406,"台灯去面包店","台灯来到面包店，门口问：“来做什么？”回答：“先给灵感补一点光，再让新计划先发酵一下。”",100,
407,zh-0407,"台灯去博物馆","台灯来到博物馆，门口问：“来做什么？”回答：“先给灵感补一点光，再看看旧问题有没有新答案。”",100,
408,zh-0408,"台灯去游泳馆","台灯来到游泳馆，门口问：“来做什么？”回答：“先给灵感补一点光，再让压力学会自己漂浮。”",100,
409,zh-0409,"台灯去邮局","台灯来到邮局，门口问：“来做什么？”回答：“先给灵感补一点光，再给未来寄一封提醒信。”",100,
410,zh-0410,"台灯去办公室","台灯来到办公室，门口问：“来做什么？”回答：“先给灵感补一点光，再给星期一安装一个补丁。”",100,
411,zh-0411,"计算器去图书馆","计算器来到图书馆，门口问：“来做什么？”回答：“先把烦恼除以一百，再给知识续个借阅期。”",100,
412,zh-0412,"计算器去咖啡店","计算器来到咖啡店，门口问：“来做什么？”回答：“先把烦恼除以一百，再把困意打包带走。”",100,
413,zh-0413,"计算器去健身房","计算器来到健身房，门口问：“来做什么？”回答：“先把烦恼除以一百，再给意志力加点负载。”",100,
414,zh-0414,"计算器去银行","计算器来到银行，门口问：“来做什么？”回答：“先把烦恼除以一百，再给快乐存一点利息。”",100,
415,zh-0415,"计算器去公园","计算器来到公园，门口问：“来做什么？”回答：“先把烦恼除以一百，再让思路好好散个步。”",100,
416,zh-0416,"计算器去超市","计算器来到超市，门口问：“来做什么？”回答：“先把烦恼除以一百，再把好运加入购物车。”",100,
417,zh-0417,"计算器去车站","计算器来到车站，门口问：“来做什么？”回答：“先把烦恼除以一百，再等下一班好心情。”",100,
418,zh-0418,"计算器去电影院","计算器来到电影院，门口问：“来做什么？”回答：“先把烦恼除以一百，再给生活换个喜剧频道。”",100,
419,zh-0419,"计算器去餐厅","计算器来到餐厅，门口问：“来做什么？”回答：“先把烦恼除以一百，再给胃安排一次会议。”",100,
420,zh-0420,"计算器去学校","计算器来到学校，门口问：“来做什么？”回答：“先把烦恼除以一百，再给好奇心补一节课。”",100,
421,zh-0421,"计算器去医院","计算器来到医院，门口问：“来做什么？”回答：“先把烦恼除以一百，再给拖延症认真挂个号。”",100,
422,zh-0422,"计算器去理发店","计算器来到理发店，门口问：“来做什么？”回答：“先把烦恼除以一百，再把烦恼再剪短一点。”",100,
423,zh-0423,"计算器去花店","计算器来到花店，门口问：“来做什么？”回答：“先把烦恼除以一百，再给普通日子配点颜色。”",100,
424,zh-0424,"计算器去面包店","计算器来到面包店，门口问：“来做什么？”回答：“先把烦恼除以一百，再让新计划先发酵一下。”",100,
425,zh-0425,"计算器去博物馆","计算器来到博物馆，门口问：“来做什么？”回答：“先把烦恼除以一百，再看看旧问题有没有新答案。”",100,
426,zh-0426,"计算器去游泳馆","计算器来到游泳馆，门口问：“来做什么？”回答：“先把烦恼除以一百，再让压力学会自己漂浮。”",100,
427,zh-0427,"计算器去邮局","计算器来到邮局，门口问：“来做什么？”回答：“先把烦恼除以一百，再给未来寄一封提醒信。”",100,
428,zh-0428,"计算器去办公室","计算器来到办公室，门口问：“来做什么？”回答：“先把烦恼除以一百，再给星期一安装一个补丁。”",100,
429,zh-0429,"日历去图书馆","日历来到图书馆，门口问：“来做什么？”回答：“先给周末多申请一天，再给知识续个借阅期。”",100,
430,zh-0430,"日历去咖啡店","日历来到咖啡店，门口问：“来做什么？”回答：“先给周末多申请一天，再把困意打包带走。”",100,
431,zh-0431,"日历去健身房","日历来到健身房，门口问：“来做什么？”回答：“先给周末多申请一天，再给意志力加点负载。”",100,
432,zh-0432,"日历去银行","日历来到银行，门口问：“来做什么？”回答：“先给周末多申请一天，再给快乐存一点利息。”",100,
433,zh-0433,"日历去公园","日历来到公园，门口问：“来做什么？”回答：“先给周末多申请一天，再让思路好好散个步。”",100,
434,zh-0434,"日历去超市","日历来到超市，门口问：“来做什么？”回答：“先给周末多申请一天，再把好运加入购物车。”",100,
435,zh-0435,"日历去车站","日历来到车站，门口问：“来做什么？”回答：“先给周末多申请一天，再等下一班好心情。”",100,
436,zh-0436,"日历去电影院","日历来到电影院，门口问：“来做什么？”回答：“先给周末多申请一天，再给生活换个喜剧频道。”",100,
437,zh-0437,"日历去餐厅","日历来到餐厅，门口问：“来做什么？”回答：“先给周末多申请一天，再给胃安排一次会议。”",100,
438,zh-0438,"日历去学校","日历来到学校，门口问：“来做什么？”回答：“先给周末多申请一天，再给好奇心补一节课。”",100,
439,zh-0439,"日历去医院","日历来到医院，门口问：“来做什么？”回答：“先给周末多申请一天，再给拖延症认真挂个号。”",100,
440,zh-0440,"日历去理发店","日历来到理发店，门口问：“来做什么？”回答：“先给周末多申请一天，再把烦恼再剪短一点。”",100,
441,zh-0441,"日历去花店","日历来到花店，门口问：“来做什么？”回答：“先给周末多申请一天，再给普通日子配点颜色。”",100,
442,zh-0442,"日历去面包店","日历来到面包店，门口问：“来做什么？”回答：“先给周末多申请一天，再让新计划先发酵一下。”",100,
443,zh-0443,"日历去博物馆","日历来到博物馆，门口问：“来做什么？”回答：“先给周末多申请一天，再看看旧问题有没有新答案。”",100,
444,zh-0444,"日历去游泳馆","日历来到游泳馆，门口问：“来做什么？”回答：“先给周末多申请一天，再让压力学会自己漂浮。”",100,
445,zh-0445,"日历去邮局","日历来到邮局，门口问：“来做什么？”回答：“先给周末多申请一天，再给未来寄一封提醒信。”",100,
446,zh-0446,"日历去办公室","日历来到办公室，门口问：“来做什么？”回答：“先给周末多申请一天，再给星期一安装一个补丁。”",100,
447,zh-0447,"耳机去图书馆","耳机来到图书馆，门口问：“来做什么？”回答：“先把噪音切成静音模式，再给知识续个借阅期。”",100,
448,zh-0448,"耳机去咖啡店","耳机来到咖啡店，门口问：“来做什么？”回答：“先把噪音切成静音模式，再把困意打包带走。”",100,
449,zh-0449,"耳机去健身房","耳机来到健身房，门口问：“来做什么？”回答：“先把噪音切成静音模式，再给意志力加点负载。”",100,
450,zh-0450,"耳机去银行","耳机来到银行，门口问：“来做什么？”回答：“先把噪音切成静音模式，再给快乐存一点利息。”",100,
451,zh-0451,"耳机去公园","耳机来到公园，门口问：“来做什么？”回答：“先把噪音切成静音模式，再让思路好好散个步。”",100,
452,zh-0452,"耳机去超市","耳机来到超市，门口问：“来做什么？”回答：“先把噪音切成静音模式，再把好运加入购物车。”",100,
453,zh-0453,"耳机去车站","耳机来到车站，门口问：“来做什么？”回答：“先把噪音切成静音模式，再等下一班好心情。”",100,
454,zh-0454,"耳机去电影院","耳机来到电影院，门口问：“来做什么？”回答：“先把噪音切成静音模式，再给生活换个喜剧频道。”",100,
455,zh-0455,"耳机去餐厅","耳机来到餐厅，门口问：“来做什么？”回答：“先把噪音切成静音模式，再给胃安排一次会议。”",100,
456,zh-0456,"耳机去学校","耳机来到学校，门口问：“来做什么？”回答：“先把噪音切成静音模式，再给好奇心补一节课。”",100,
457,zh-0457,"耳机去医院","耳机来到医院，门口问：“来做什么？”回答：“先把噪音切成静音模式，再给拖延症认真挂个号。”",100,
458,zh-0458,"耳机去理发店","耳机来到理发店，门口问：“来做什么？”回答：“先把噪音切成静音模式，再把烦恼再剪短一点。”",100,
459,zh-0459,"耳机去花店","耳机来到花店，门口问：“来做什么？”回答：“先把噪音切成静音模式，再给普通日子配点颜色。”",100,
460,zh-0460,"耳机去面包店","耳机来到面包店，门口问：“来做什么？”回答：“先把噪音切成静音模式，再让新计划先发酵一下。”",100,
461,zh-0461,"耳机去博物馆","耳机来到博物馆，门口问：“来做什么？”回答：“先把噪音切成静音模式，再看看旧问题有没有新答案。”",100,
462,zh-0462,"耳机去游泳馆","耳机来到游泳馆，门口问：“来做什么？”回答：“先把噪音切成静音模式，再让压力学会自己漂浮。”",100,
463,zh-0463,"耳机去邮局","耳机来到邮局，门口问：“来做什么？”回答：“先把噪音切成静音模式，再给未来寄一封提醒信。”",100,
464,zh-0464,"耳机去办公室","耳机来到办公室，门口问：“来做什么？”回答：“先把噪音切成静音模式，再给星期一安装一个补丁。”",100,
465,zh-0465,"相机去图书馆","相机来到图书馆，门口问：“来做什么？”回答：“先给普通日子加个滤镜，再给知识续个借阅期。”",100,
466,zh-0466,"相机去咖啡店","相机来到咖啡店，门口问：“来做什么？”回答：“先给普通日子加个滤镜，再把困意打包带走。”",100,
467,zh-0467,"相机去健身房","相机来到健身房，门口问：“来做什么？”回答：“先给普通日子加个滤镜，再给意志力加点负载。”",100,
468,zh-0468,"相机去银行","相机来到银行，门口问：“来做什么？”回答：“先给普通日子加个滤镜，再给快乐存一点利息。”",100,
