joke_id,source_id,title,body,score,permalink
469,zh-0469,"相机去公园","相机来到公园，门口问：“来做什么？”回答：“先给普通日子加个滤镜，再让思路好好散个步。”",100,
470,zh-0470,"相机去超市","相机来到超市，门口问：“来做什么？”回答：“先给普通日子加个滤镜，再把好运加入购物车。”",100,
471,zh-0471,"相机去车站","相机来到车站，门口问：“来做什么？”回答：“先给普通日子加个滤镜，再等下一班好心情。”",100,
472,zh-0472,"相机去电影院","相机来到电影院，门口问：“来做什么？”回答：“先给普通日子加个滤镜，再给生活换个喜剧频道。”",100,
473,zh-0473,"相机去餐厅","相机来到餐厅，门口问：“来做什么？”回答：“先给普通日子加个滤镜，再给胃安排一次会议。”",100,
474,zh-0474,"相机去学校","相机来到学校，门口问：“来做什么？”回答：“先给普通日子加个滤镜，再给好奇心补一节课。”",100,
475,zh-0475,"相机去医院","相机来到医院，门口问：“来做什么？”回答：“先给普通日子加个滤镜，再给拖延症认真挂个号。”",100,
476,zh-0476,"相机去理发店","相机来到理发店，门口问：“来做什么？”回答：“先给普通日子加个滤镜，再把烦恼再剪短一点。”",100,
477,zh-0477,"相机去花店","相机来到花店，门口问：“来做什么？”回答：“先给普通日子加个滤镜，再给普通日子配点颜色。”",100,
478,zh-0478,"相机去面包店","相机来到面包店，门口问：“来做什么？”回答：“先给普通日子加个滤镜，再让新计划先发酵一下。”",100,
479,zh-0479,"相机去博物馆","相机来到博物馆，门口问：“来做什么？”回答：“先给普通日子加个滤镜，再看看旧问题有没有新答案。”",100,
480,zh-0480,"相机去游泳馆","相机来到游泳馆，门口问：“来做什么？”回答：“先给普通日子加个滤镜，再让压力学会自己漂浮。”",100,
481,zh-0481,"相机去邮局","相机来到邮局，门口问：“来做什么？”回答：“先给普通日子加个滤镜，再给未来寄一封提醒信。”",100,
482,zh-0482,"相机去办公室","相机来到办公室，门口问：“来做什么？”回答：“先给普通日子加个滤镜，再给星期一安装一个补丁。”",100,
483,zh-0483,"机器人去图书馆","机器人来到图书馆，门口问：“来做什么？”回答：“先给幽默模块升个级，再给知识续个借阅期。”",100,
484,zh-0484,"机器人去咖啡店","机器人来到咖啡店，门口问：“来做什么？”回答：“先给幽默模块升个级，再把困意打包带走。”",100,
485,zh-0485,"机器人去健身房","机器人来到健身房，门口问：“来做什么？”回答：“先给幽默模块升个级，再给意志力加点负载。”",100,
486,zh-0486,"机器人去银行","机器人来到银行，门口问：“来做什么？”回答：“先给幽默模块升个级，再给快乐存一点利息。”",100,
487,zh-0487,"机器人去公园","机器人来到公园，门口问：“来做什么？”回答：“先给幽默模块升个级，再让思路好好散个步。”",100,
488,zh-0488,"机器人去超市","机器人来到超市，门口问：“来做什么？”回答：“先给幽默模块升个级，再把好运加入购物车。”",100,
489,zh-0489,"机器人去车站","机器人来到车站，门口问：“来做什么？”回答：“先给幽默模块升个级，再等下一班好心情。”",100,
490,zh-0490,"机器人去电影院","机器人来到电影院，门口问：“来做什么？”回答：“先给幽默模块升个级，再给生活换个喜剧频道。”",100,
491,zh-0491,"机器人去餐厅","机器人来到餐厅，门口问：“来做什么？”回答：“先给幽默模块升个级，再给胃安排一次会议。”",100,
492,zh-0492,"机器人去学校","机器人来到学校，门口问：“来做什么？”回答：“先给幽默模块升个级，再给好奇心补一节课。”",100,
493,zh-0493,"机器人去医院","机器人来到医院，门口问：“来做什么？”回答：“先给幽默模块升个级，再给拖延症认真挂个号。”",100,
494,zh-0494,"机器人去理发店","机器人来到理发店，门口问：“来做什么？”回答：“先给幽默模块升个级，再把烦恼再剪短一点。”",100,
495,zh-0495,"机器人去花店","机器人来到花店，门口问：“来做什么？”回答：“先给幽默模块升个级，再给普通日子配点颜色。”",100,
496,zh-0496,"机器人去面包店","机器人来到面包店，门口问：“来做什么？”回答：“先给幽默模块升个级，再让新计划先发酵一下。”",100,
497,zh-0497,"机器人去博物馆","机器人来到博物馆，门口问：“来做什么？”回答：“先给幽默模块升个级，再看看旧问题有没有新答案。”",100,
498,zh-0498,"机器人去游泳馆","机器人来到游泳馆，门口问：“来做什么？”回答：“先给幽默模块升个级，再让压力学会自己漂浮。”",100,
499,zh-0499,"机器人去邮局","机器人来到邮局，门口问：“来做什么？”回答：“先给幽默模块升个级，再给未来寄一封提醒信。”",100,
500,zh-0500,"机器人去办公室","机器人来到办公室，门口问：“来做什么？”回答：“先给幽默模块升个级，再给星期一安装一个补丁。”",100,
