joke_id,source_id,title,body,score,permalink
171,zh-0171,"打印机去花店","打印机来到花店，门口问：“来做什么？”回答：“先把好心情打印两份，再给普通日子配点颜色。”",100,
172,zh-0172,"打印机去面包店","打印机来到面包店，门口问：“来做什么？”回答：“先把好心情打印两份，再让新计划先发酵一下。”",100,
173,zh-0173,"打印机去博物馆","打印机来到博物馆，门口问：“来做什么？”回答：“先把好心情打印两份，再看看旧问题有没有新答案。”",100,
174,zh-0174,"打印机去游泳馆","打印机来到游泳馆，门口问：“来做什么？”回答：“先把好心情打印两份，再让压力学会自己漂浮。”",100,
175,zh-0175,"打印机去邮局","打印机来到邮局，门口问：“来做什么？”回答：“先把好心情打印两份，再给未来寄一封提醒信。”",100,
176,zh-0176,"打印机去办公室","打印机来到办公室，门口问：“来做什么？”回答：“先把好心情打印两份，再给星期一安装一个补丁。”",100,
177,zh-0177,"闹钟去图书馆","闹钟来到图书馆，门口问：“来做什么？”回答：“先把赖床设置成稍后提醒，再给知识续个借阅期。”",100,
178,zh-0178,"闹钟去咖啡店","闹钟来到咖啡店，门口问：“来做什么？”回答：“先把赖床设置成稍后提醒，再把困意打包带走。”",100,
179,zh-0179,"闹钟去健身房","闹钟来到健身房，门口问：“来做什么？”回答：“先把赖床设置成稍后提醒，再给意志力加点负载。”",100,
180,zh-0180,"闹钟去银行","闹钟来到银行，门口问：“来做什么？”回答：“先把赖床设置成稍后提醒，再给快乐存一点利息。”",100,
181,zh-0181,"闹钟去公园","闹钟来到公园，门口问：“来做什么？”回答：“先把赖床设置成稍后提醒，再让思路好好散个步。”",100,
182,zh-0182,"闹钟去超市","闹钟来到超市，门口问：“来做什么？”回答：“先把赖床设置成稍后提醒，再把好运加入购物车。”",100,
183,zh-0183,"闹钟去车站","闹钟来到车站，门口问：“来做什么？”回答：“先把赖床设置成稍后提醒，再等下一班好心情。”",100,
184,zh-0184,"闹钟去电影院","闹钟来到电影院，门口问：“来做什么？”回答：“先把赖床设置成稍后提醒，再给生活换个喜剧频道。”",100,
185,zh-0185,"闹钟去餐厅","闹钟来到餐厅，门口问：“来做什么？”回答：“先把赖床设置成稍后提醒，再给胃安排一次会议。”",100,
186,zh-0186,"闹钟去学校","闹钟来到学校，门口问：“来做什么？”回答：“先把赖床设置成稍后提醒，再给好奇心补一节课。”",100,
187,zh-0187,"闹钟去医院","闹钟来到医院，门口问：“来做什么？”回答：“先把赖床设置成稍后提醒，再给拖延症认真挂个号。”",100,
188,zh-0188,"闹钟去理发店","闹钟来到理发店，门口问：“来做什么？”回答：“先把赖床设置成稍后提醒，再把烦恼再剪短一点。”",100,
189,zh-0189,"闹钟去花店","闹钟来到花店，门口问：“来做什么？”回答：“先把赖床设置成稍后提醒，再给普通日子配点颜色。”",100,
190,zh-0190,"闹钟去面包店","闹钟来到面包店，门口问：“来做什么？”回答：“先把赖床设置成稍后提醒，再让新计划先发酵一下。”",100,
191,zh-0191,"闹钟去博物馆","闹钟来到博物馆，门口问：“来做什么？”回答：“先把赖床设置成稍后提醒，再看看旧问题有没有新答案。”",100,
192,zh-0192,"闹钟去游泳馆","闹钟来到游泳馆，门口问：“来做什么？”回答：“先把赖床设置成稍后提醒，再让压力学会自己漂浮。”",100,
193,zh-0193,"闹钟去邮局","闹钟来到邮局，门口问：“来做什么？”回答：“先把赖床设置成稍后提醒，再给未来寄一封提醒信。”",100,
194,zh-0194,"闹钟去办公室","闹钟来到办公室，门口问：“来做什么？”回答：“先把赖床设置成稍后提醒，再给星期一安装一个补丁。”",100,
195,zh-0195,"冰箱去图书馆","冰箱来到图书馆，门口问：“来做什么？”回答：“先给冷静保个鲜，再给知识续个借阅期。”",100,
196,zh-0196,"冰箱去咖啡店","冰箱来到咖啡店，门口问：“来做什么？”回答：“先给冷静保个鲜，再把困意打包带走。”",100,
197,zh-0197,"冰箱去健身房","冰箱来到健身房，门口问：“来做什么？”回答：“先给冷静保个鲜，再给意志力加点负载。”",100,
198,zh-0198,"冰箱去银行","冰箱来到银行，门口问：“来做什么？”回答：“先给冷静保个鲜，再给快乐存一点利息。”",100,
199,zh-0199,"冰箱去公园","冰箱来到公园，门口问：“来做什么？”回答：“先给冷静保个鲜，再让思路好好散个步。”",100,
200,zh-0200,"冰箱去超市","冰箱来到超市，门口问：“来做什么？”回答：“先给冷静保个鲜，再把好运加入购物车。”",100,
201,zh-0201,"冰箱去车站","冰箱来到车站，门口问：“来做什么？”回答：“先给冷静保个鲜，再等下一班好心情。”",100,
202,zh-0202,"冰箱去电影院","冰箱来到电影院，门口问：“来做什么？”回答：“先给冷静保个鲜，再给生活换个喜剧频道。”",100,
203,zh-0203,"冰箱去餐厅","冰箱来到餐厅，门口问：“来做什么？”回答：“先给冷静保个鲜，再给胃安排一次会议。”",100,
204,zh-0204,"冰箱去学校","冰箱来到学校，门口问：“来做什么？”回答：“先给冷静保个鲜，再给好奇心补一节课。”",100,
205,zh-0205,"冰箱去医院","冰箱来到医院，门口问：“来做什么？”回答：“先给冷静保个鲜，再给拖延症认真挂个号。”",100,
206,zh-0206,"冰箱去理发店","冰箱来到理发店，门口问：“来做什么？”回答：“先给冷静保个鲜，再把烦恼再剪短一点。”",100,
207,zh-0207,"冰箱去花店","冰箱来到花店，门口问：“来做什么？”回答：“先给冷静保个鲜，再给普通日子配点颜色。”",100,
208,zh-0208,"冰箱去面包店","冰箱来到面包店，门口问：“来做什么？”回答：“先给冷静保个鲜，再让新计划先发酵一下。”",100,
209,zh-0209,"冰箱去博物馆","冰箱来到博物馆，门口问：“来做什么？”回答：“先给冷静保个鲜，再看看旧问题有没有新答案。”",100,
210,zh-0210,"冰箱去游泳馆","冰箱来到游泳馆，门口问：“来做什么？”回答：“先给冷静保个鲜，再让压力学会自己漂浮。”",100,
211,zh-0211,"冰箱去邮局","冰箱来到邮局，门口问：“来做什么？”回答：“先给冷静保个鲜，再给未来寄一封提醒信。”",100,
212,zh-0212,"冰箱去办公室","冰箱来到办公室，门口问：“来做什么？”回答：“先给冷静保个鲜，再给星期一安装一个补丁。”",100,
213,zh-0213,"电风扇去图书馆","电风扇来到图书馆，门口问：“来做什么？”回答：“先把烦恼吹成循环模式，再给知识续个借阅期。”",100,
214,zh-0214,"电风扇去咖啡店","电风扇来到咖啡店，门口问：“来做什么？”回答：“先把烦恼吹成循环模式，再把困意打包带走。”",100,
215,zh-0215,"电风扇去健身房","电风扇来到健身房，门口问：“来做什么？”回答：“先把烦恼吹成循环模式，再给意志力加点负载。”",100,
216,zh-0216,"电风扇去银行","电风扇来到银行，门口问：“来做什么？”回答：“先把烦恼吹成循环模式，再给快乐存一点利息。”",100,
217,zh-0217,"电风扇去公园","电风扇来到公园，门口问：“来做什么？”回答：“先把烦恼吹成循环模式，再让思路好好散个步。”",100,
218,zh-0218,"电风扇去超市","电风扇来到超市，门口问：“来做什么？”回答：“先把烦恼吹成循环模式，再把好运加入购物车。”",100,
219,zh-0219,"电风扇去车站","电风扇来到车站，门口问：“来做什么？”回答：“先把烦恼吹成循环模式，再等下一班好心情。”",100,
220,zh-0220,"电风扇去电影院","电风扇来到电影院，门口问：“来做什么？”回答：“先把烦恼吹成循环模式，再给生活换个喜剧频道。”",100,
221,zh-0221,"电风扇去餐厅","电风扇来到餐厅，门口问：“来做什么？”回答：“先把烦恼吹成循环模式，再给胃安排一次会议。”",100,
222,zh-0222,"电风扇去学校","电风扇来到学校，门口问：“来做什么？”回答：“先把烦恼吹成循环模式，再给好奇心补一节课。”",100,
223,zh-0223,"电风扇去医院","电风扇来到医院，门口问：“来做什么？”回答：“先把烦恼吹成循环模式，再给拖延症认真挂个号。”",100,
224,zh-0224,"电风扇去理发店","电风扇来到理发店，门口问：“来做什么？”回答：“先把烦恼吹成循环模式，再把烦恼再剪短一点。”",100,
225,zh-0225,"电风扇去花店","电风扇来到花店，门口问：“来做什么？”回答：“先把烦恼吹成循环模式，再给普通日子配点颜色。”",100,
226,zh-0226,"电风扇去面包店","电风扇来到面包店，门口问：“来做什么？”回答：“先把烦恼吹成循环模式，再让新计划先发酵一下。”",100,
227,zh-0227,"电风扇去博物馆","电风扇来到博物馆，门口问：“来做什么？”回答：“先把烦恼吹成循环模式，再看看旧问题有没有新答案。”",100,
228,zh-0228,"电风扇去游泳馆","电风扇来到游泳馆，门口问：“来做什么？”回答：“先把烦恼吹成循环模式，再让压力学会自己漂浮。”",100,
229,zh-0229,"电风扇去邮局","电风扇来到邮局，门口问：“来做什么？”回答：“先把烦恼吹成循环模式，再给未来寄一封提醒信。”",100,
230,zh-0230,"电风扇去办公室","电风扇来到办公室，门口问：“来做什么？”回答：“先把烦恼吹成循环模式，再给星期一安装一个补丁。”",100,
231,zh-0231,"铅笔去图书馆","铅笔来到图书馆，门口问：“来做什么？”回答：“先给计划留一点修改空间，再给知识续个借阅期。”",100,
232,zh-0232,"铅笔去咖啡店","铅笔来到咖啡店，门口问：“来做什么？”回答：“先给计划留一点修改空间，再把困意打包带走。”",100,
233,zh-0233,"铅笔去健身房","铅笔来到健身房，门口问：“来做什么？”回答：“先给计划留一点修改空间，再给意志力加点负载。”",100,
234,zh-0234,"铅笔去银行","铅笔来到银行，门口问：“来做什么？”回答：“先给计划留一点修改空间，再给快乐存一点利息。”",100,
235,zh-0235,"铅笔去公园","铅笔来到公园，门口问：“来做什么？”回答：“先给计划留一点修改空间，再让思路好好散个步。”",100,
236,zh-0236,"铅笔去超市","铅笔来到超市，门口问：“来做什么？”回答：“先给计划留一点修改空间，再把好运加入购物车。”",100,
237,zh-0237,"铅笔去车站","铅笔来到车站，门口问：“来做什么？”回答：“先给计划留一点修改空间，再等下一班好心情。”",100,
238,zh-0238,"铅笔去电影院","铅笔来到电影院，门口问：“来做什么？”回答：“先给计划留一点修改空间，再给生活换个喜剧频道。”",100,
239,zh-0239,"铅笔去餐厅","铅笔来到餐厅，门口问：“来做什么？”回答：“先给计划留一点修改空间，再给胃安排一次会议。”",100,
240,zh-0240,"铅笔去学校","铅笔来到学校，门口问：“来做什么？”回答：“先给计划留一点修改空间，再给好奇心补一节课。”",100,
241,zh-0241,"铅笔去医院","铅笔来到医院，门口问：“来做什么？”回答：“先给计划留一点修改空间，再给拖延症认真挂个号。”",100,
242,zh-0242,"铅笔去理发店","铅笔来到理发店，门口问：“来做什么？”回答：“先给计划留一点修改空间，再把烦恼再剪短一点。”",100,
243,zh-0243,"铅笔去花店","铅笔来到花店，门口问：“来做什么？”回答：“先给计划留一点修改空间，再给普通日子配点颜色。”",100,
244,zh-0244,"铅笔去面包店","铅笔来到面包店，门口问：“来做什么？”回答：“先给计划留一点修改空间，再让新计划先发酵一下。”",100,
245,zh-0245,"铅笔去博物馆","铅笔来到博物馆，门口问：“来做什么？”回答：“先给计划留一点修改空间，再看看旧问题有没有新答案。”",100,
246,zh-0246,"铅笔去游泳馆","铅笔来到游泳馆，门口问：“来做什么？”回答：“先给计划留一点修改空间，再让压力学会自己漂浮。”",100,
247,zh-0247,"铅笔去邮局","铅笔来到邮局，门口问：“来做什么？”回答：“先给计划留一点修改空间，再给未来寄一封提醒信。”",100,
248,zh-0248,"铅笔去办公室","铅笔来到办公室，门口问：“来做什么？”回答：“先给计划留一点修改空间，再给星期一安装一个补丁。”",100,
249,zh-0249,"橡皮去图书馆","橡皮来到图书馆，门口问：“来做什么？”回答：“先擦掉昨天的小尴尬，再给知识续个借阅期。”",100,
250,zh-0250,"橡皮去咖啡店","橡皮来到咖啡店，门口问：“来做什么？”回答：“先擦掉昨天的小尴尬，再把困意打包带走。”",100,
251,zh-0251,"橡皮去健身房","橡皮来到健身房，门口问：“来做什么？”回答：“先擦掉昨天的小尴尬，再给意志力加点负载。”",100,
252,zh-0252,"橡皮去银行","橡皮来到银行，门口问：“来做什么？”回答：“先擦掉昨天的小尴尬，再给快乐存一点利息。”",100,
253,zh-0253,"橡皮去公园","橡皮来到公园，门口问：“来做什么？”回答：“先擦掉昨天的小尴尬，再让思路好好散个步。”",100,
254,zh-0254,"橡皮去超市","橡皮来到超市，门口问：“来做什么？”回答：“先擦掉昨天的小尴尬，再把好运加入购物车。”",100,
255,zh-0255,"橡皮去车站","橡皮来到车站，门口问：“来做什么？”回答：“先擦掉昨天的小尴尬，再等下一班好心情。”",100,
256,zh-0256,"橡皮去电影院","橡皮来到电影院，门口问：“来做什么？”回答：“先擦掉昨天的小尴尬，再给生活换个喜剧频道。”",100,
257,zh-0257,"橡皮去餐厅","橡皮来到餐厅，门口问：“来做什么？”回答：“先擦掉昨天的小尴尬，再给胃安排一次会议。”",100,
258,zh-0258,"橡皮去学校","橡皮来到学校，门口问：“来做什么？”回答：“先擦掉昨天的小尴尬，再给好奇心补一节课。”",100,
259,zh-0259,"橡皮去医院","橡皮来到医院，门口问：“来做什么？”回答：“先擦掉昨天的小尴尬，再给拖延症认真挂个号。”",100,
260,zh-0260,"橡皮去理发店","橡皮来到理发店，门口问：“来做什么？”回答：“先擦掉昨天的小尴尬，再把烦恼再剪短一点。”",100,
261,zh-0261,"橡皮去花店","橡皮来到花店，门口问：“来做什么？”回答：“先擦掉昨天的小尴尬，再给普通日子配点颜色。”",100,
262,zh-0262,"橡皮去面包店","橡皮来到面包店，门口问：“来做什么？”回答：“先擦掉昨天的小尴尬，再让新计划先发酵一下。”",100,
263,zh-0263,"橡皮去博物馆","橡皮来到博物馆，门口问：“来做什么？”回答：“先擦掉昨天的小尴尬，再看看旧问题有没有新答案。”",100,
264,zh-0264,"橡皮去游泳馆","橡皮来到游泳馆，门口问：“来做什么？”回答：“先擦掉昨天的小尴尬，再让压力学会自己漂浮。”",100,
265,zh-0265,"橡皮去邮局","橡皮来到邮局，门口问：“来做什么？”回答：“先擦掉昨天的小尴尬，再给未来寄一封提醒信。”",100,
266,zh-0266,"橡皮去办公室","橡皮来到办公室，门口问：“来做什么？”回答：“先擦掉昨天的小尴尬，再给星期一安装一个补丁。”",100,
267,zh-0267,"书包去图书馆","书包来到图书馆，门口问：“来做什么？”回答：“先把压力分几个口袋装，再给知识续个借阅期。”",100,
268,zh-0268,"书包去咖啡店","书包来到咖啡店，门口问：“来做什么？”回答：“先把压力分几个口袋装，再把困意打包带走。”",100,
269,zh-0269,"书包去健身房","书包来到健身房，门口问：“来做什么？”回答：“先把压力分几个口袋装，再给意志力加点负载。”",100,
270,zh-0270,"书包去银行","书包来到银行，门口问：“来做什么？”回答：“先把压力分几个口袋装，再给快乐存一点利息。”",100,
271,zh-0271,"书包去公园","书包来到公园，门口问：“来做什么？”回答：“先把压力分几个口袋装，再让思路好好散个步。”",100,
272,zh-0272,"书包去超市","书包来到超市，门口问：“来做什么？”回答：“先把压力分几个口袋装，再把好运加入购物车。”",100,
273,zh-0273,"书包去车站","书包来到车站，门口问：“来做什么？”回答：“先把压力分几个口袋装，再等下一班好心情。”",100,
274,zh-0274,"书包去电影院","书包来到电影院，门口问：“来做什么？”回答：“先把压力分几个口袋装，再给生活换个喜剧频道。”",100,
275,zh-0275,"书包去餐厅","书包来到餐厅，门口问：“来做什么？”回答：“先把压力分几个口袋装，再给胃安排一次会议。”",100,
276,zh-0276,"书包去学校","书包来到学校，门口问：“来做什么？”回答：“先把压力分几个口袋装，再给好奇心补一节课。”",100,
277,zh-0277,"书包去医院","书包来到医院，门口问：“来做什么？”回答：“先把压力分几个口袋装，再给拖延症认真挂个号。”",100,
278,zh-0278,"书包去理发店","书包来到理发店，门口问：“来做什么？”回答：“先把压力分几个口袋装，再把烦恼再剪短一点。”",100,
279,zh-0279,"书包去花店","书包来到花店，门口问：“来做什么？”回答：“先把压力分几个口袋装，再给普通日子配点颜色。”",100,
280,zh-0280,"书包去面包店","书包来到面包店，门口问：“来做什么？”回答：“先把压力分几个口袋装，再让新计划先发酵一下。”",100,
281,zh-0281,"书包去博物馆","书包来到博物馆，门口问：“来做什么？”回答：“先把压力分几个口袋装，再看看旧问题有没有新答案。”",100,
282,zh-0282,"书包去游泳馆","书包来到游泳馆，门口问：“来做什么？”回答：“先把压力分几个口袋装，再让压力学会自己漂浮。”",100,
283,zh-0283,"书包去邮局","书包来到邮局，门口问：“来做什么？”回答：“先把压力分几个口袋装，再给未来寄一封提醒信。”",100,
284,zh-0284,"书包去办公室","书包来到办公室，门口问：“来做什么？”回答：“先把压力分几个口袋装，再给星期一安装一个补丁。”",100,
285,zh-0285,"雨伞去图书馆","雨伞来到图书馆，门口问：“来做什么？”回答：“先给坏天气撑个场面，再给知识续个借阅期。”",100,
286,zh-0286,"雨伞去咖啡店","雨伞来到咖啡店，门口问：“来做什么？”回答：“先给坏天气撑个场面，再把困意打包带走。”",100,
287,zh-0287,"雨伞去健身房","雨伞来到健身房，门口问：“来做什么？”回答：“先给坏天气撑个场面，再给意志力加点负载。”",100,
288,zh-0288,"雨伞去银行","雨伞来到银行，门口问：“来做什么？”回答：“先给坏天气撑个场面，再给快乐存一点利息。”",100,
289,zh-0289,"雨伞去公园","雨伞来到公园，门口问：“来做什么？”回答：“先给坏天气撑个场面，再让思路好好散个步。”",100,
290,zh-0290,"雨伞去超市","雨伞来到超市，门口问：“来做什么？”回答：“先给坏天气撑个场面，再把好运加入购物车。”",100,
291,zh-0291,"雨伞去车站","雨伞来到车站，门口问：“来做什么？”回答：“先给坏天气撑个场面，再等下一班好心情。”",100,
292,zh-0292,"雨伞去电影院","雨伞来到电影院，门口问：“来做什么？”回答：“先给坏天气撑个场面，再给生活换个喜剧频道。”",100,
293,zh-0293,"雨伞去餐厅","雨伞来到餐厅，门口问：“来做什么？”回答：“先给坏天气撑个场面，再给胃安排一次会议。”",100,
294,zh-0294,"雨伞去学校","雨伞来到学校，门口问：“来做什么？”回答：“先给坏天气撑个场面，再给好奇心补一节课。”",100,
295,zh-0295,"雨伞去医院","雨伞来到医院，门口问：“来做什么？”回答：“先给坏天气撑个场面，再给拖延症认真挂个号。”",100,
296,zh-0296,"雨伞去理发店","雨伞来到理发店，门口问：“来做什么？”回答：“先给坏天气撑个场面，再把烦恼再剪短一点。”",100,
297,zh-0297,"雨伞去花店","雨伞来到花店，门口问：“来做什么？”回答：“先给坏天气撑个场面，再给普通日子配点颜色。”",100,
298,zh-0298,"雨伞去面包店","雨伞来到面包店，门口问：“来做什么？”回答：“先给坏天气撑个场面，再让新计划先发酵一下。”",100,
299,zh-0299,"雨伞去博物馆","雨伞来到博物馆，门口问：“来做什么？”回答：“先给坏天气撑个场面，再看看旧问题有没有新答案。”",100,
300,zh-0300,"雨伞去游泳馆","雨伞来到游泳馆，门口问：“来做什么？”回答：“先给坏天气撑个场面，再让压力学会自己漂浮。”",100,
301,zh-0301,"雨伞去邮局","雨伞来到邮局，门口问：“来做什么？”回答：“先给坏天气撑个场面，再给未来寄一封提醒信。”",100,
302,zh-0302,"雨伞去办公室","雨伞来到办公室，门口问：“来做什么？”回答：“先给坏天气撑个场面，再给星期一安装一个补丁。”",100,
303,zh-0303,"镜子去图书馆","镜子来到图书馆，门口问：“来做什么？”回答：“先和今天的自己对个焦，再给知识续个借阅期。”",100,
304,zh-0304,"镜子去咖啡店","镜子来到咖啡店，门口问：“来做什么？”回答：“先和今天的自己对个焦，再把困意打包带走。”",100,
305,zh-0305,"镜子去健身房","镜子来到健身房，门口问：“来做什么？”回答：“先和今天的自己对个焦，再给意志力加点负载。”",100,
306,zh-0306,"镜子去银行","镜子来到银行，门口问：“来做什么？”回答：“先和今天的自己对个焦，再给快乐存一点利息。”",100,
307,zh-0307,"镜子去公园","镜子来到公园，门口问：“来做什么？”回答：“先和今天的自己对个焦，再让思路好好散个步。”",100,
308,zh-0308,"镜子去超市","镜子来到超市，门口问：“来做什么？”回答：“先和今天的自己对个焦，再把好运加入购物车。”",100,
309,zh-0309,"镜子去车站","镜子来到车站，门口问：“来做什么？”回答：“先和今天的自己对个焦，再等下一班好心情。”",100,
310,zh-0310,"镜子去电影院","镜子来到电影院，门口问：“来做什么？”回答：“先和今天的自己对个焦，再给生活换个喜剧频道。”",100,
311,zh-0311,"镜子去餐厅","镜子来到餐厅，门口问：“来做什么？”回答：“先和今天的自己对个焦，再给胃安排一次会议。”",100,
312,zh-0312,"镜子去学校","镜子来到学校，门口问：“来做什么？”回答：“先和今天的自己对个焦，再给好奇心补一节课。”",100,
313,zh-0313,"镜子去医院","镜子来到医院，门口问：“来做什么？”回答：“先和今天的自己对个焦，再给拖延症认真挂个号。”",100,
314,zh-0314,"镜子去理发店","镜子来到理发店，门口问：“来做什么？”回答：“先和今天的自己对个焦，再把烦恼再剪短一点。”",100,
315,zh-0315,"镜子去花店","镜子来到花店，门口问：“来做什么？”回答：“先和今天的自己对个焦，再给普通日子配点颜色。”",100,
316,zh-0316,"镜子去面包店","镜子来到面包店，门口问：“来做什么？”回答：“先和今天的自己对个焦，再让新计划先发酵一下。”",100,
317,zh-0317,"镜子去博物馆","镜子来到博物馆，门口问：“来做什么？”回答：“先和今天的自己对个焦，再看看旧问题有没有新答案。”",100,
318,zh-0318,"镜子去游泳馆","镜子来到游泳馆，门口问：“来做什么？”回答：“先和今天的自己对个焦，再让压力学会自己漂浮。”",100,
